問題文,選択肢1,選択肢2,選択肢3,選択肢4,正解番号(0-3),カテゴリー(パーティ/歴史/マインクラフト/F1),難易度(1-5)
ファントムを効率よく倒すために、着地地点に設置して捕獲するのにおすすめなアイテムは何か,トロッコ,ボート,クモの巣,ハチミツブロック,1,マインクラフト,4
「泡」がある場所に粉雪を使ってバグで作ることができる、本来ありえない状態は何か,凍った泡,水のない泡,燃える泡,黒い泡,1,マインクラフト,5
エンチャント「落下耐性」が持つ、落下ダメージ軽減以外の隠れた効果は何か,移動速度低下を防ぐ,エンダーパール使用時のダメージ軽減,ノックバックを無効化,スニーク速度上昇,1,マインクラフト,4
クロスボウで花火を撃つ際、ダメージを2～3倍に増やすために花火のクラフトで大量に入れると良いものは何か,火薬,ダイヤモンド,花火の星,紙,2,マインクラフト,4
柵(フェンス)の代わりとして使用できる、モブが飛び越えられない「ブロックと穴」の組み合わせで使うブロックは何か,スライムブロック,ハチミツブロック,マグマブロック,ソウルサンド,1,マインクラフト,4
地下を透視するバグ技で、フェンスの上から落として自分の頭に埋めるアイテムは何か,砂,砂利,金床,コンクリートパウダー,1,マインクラフト,5
村人が寝ている時の姿勢(腕の位置)はどうなっているか,常に胸の上で組んでいる,常に気をつけの姿勢,万歳などランダムで決まる,枕の下に入れている,2,マインクラフト,5
スニッファーの卵を「コケブロック」の上に置くと、孵化時間は約何分になるか,5分,10分,15分,20分,1,マインクラフト,3
統合版において、敵モブが持っている装備を新品の状態で確実に入手するために行う行動は何か,より良い装備を投げ渡す,水をかける,雷に打たせる,透明化のポーションをかける,0,マインクラフト,4
「アイテムのレアリティ色」において、エンチャントされた金リンゴやコマンドブロックは何色(ランク)に分類されるか,白(コモン),黄(アンコモン),水色(レア),紫(エピック),3,マインクラフト,4
森の洋館の隠し部屋にある「トラップチェスト」を開けると、TNTが起爆して何が出現するトラップがあるか,クリーパー,シルバーフィッシュ,ヴェックス,大量の砂,1,マインクラフト,5
「製図台」を作成するために必要な材料は「紙」と何か,原木,板材,棒,ハーフブロック,1,マインクラフト,2
「機織り機」を作成するために必要な材料は「板材」と何か,棒,羊毛,糸,鉄インゴット,2,マインクラフト,2
「樽」を作成するために必要な材料は「板材」と何か(統合版レシピ),棒,ハーフブロック,鉄塊,原木,1,マインクラフト,2
「調合台(醸造台)」を作成するために必要な材料は「ブレイズロッド」と何か,丸石,鉄インゴット,滑らかな石,レンガ,0,マインクラフト,2
「矢細工台」を作成するために必要な材料は「板材」と何か,棒,羽根,火打石,鉄塊,2,マインクラフト,2
Ver1.21で追加された「虫食いのポーション」を醸造するために必要な素材はどれか,発酵したクモの目,石,シルバーフィッシュの入り,砂利,1,マインクラフト,4
Ver1.21で追加された武器「メイス」に付与できる、攻撃時に高くジャンプできるエンチャントはどれか,ウィンドバースト(爆風),跳躍,激流,ノックバック,0,マインクラフト,3
Ver1.21で追加された「防具貫通(違反)」エンチャントの最大レベルはいくつか,III,IV,V,I,1,マインクラフト,3
森の洋館に存在する隠し部屋のうち、黒曜石の塊の中に隠されているブロックは何か,金ブロック,ダイヤモンドブロック,エメラルドブロック,ネザライトブロック,1,マインクラフト,5
「怪しげなシチュー」のクラフトで「スズラン」を使用した場合、付与される効果は何か,毒,再生,盲目,弱体化,0,マインクラフト,4
「怪しげなシチュー」のクラフトで「チューリップ」を使用した場合、付与される効果は何か,耐火,弱体化,跳躍,採掘速度低下,1,マインクラフト,4
食料の中で、「ステーキ」や「焼き豚」を食べた時の満腹度回復量はいくつか,6,7,8,10,2,マインクラフト,2
「パン」を食べた時の満腹度回復量はいくつか,4,5,6,8,1,マインクラフト,1
「ケーキ」を設置して1切れ食べた時の満腹度回復量はいくつか,1,2,3,4,1,マインクラフト,2
「コンポスター」を使って骨粉を作る際、一番最初に入れたアイテムはどうなる仕様か,確率で堆肥化する,必ず堆肥化する(層が上がる),消滅する,倍になる,1,マインクラフト,5
鉄鉱石が最も多く生成されるとされるY座標（高さ）はどこか,Y=-64,Y=-16,Y=128,Y=232,3,マインクラフト,5
看板やチャットで記号の「点3つ(...)」を入力すると、どのような絵文字に変換されるか,クリーパー,ハート,剣,ツルハシ,1,マインクラフト,5
統合版で「雪のネザーゲート」を作るバグ技において、発射装置に入れて使用するアイテムはどれか,雪玉,氷塊,雪ブロック,粉雪入りバケツ,3,マインクラフト,5
ラクダに乗った状態で、足元にあるものに向かって釣竿を使うと空を飛べるバグ技で使うものは何か,ボート,トロッコ,防具立て,豚,1,マインクラフト,5
ピグリンの怒りレベルが「1(軽度)」の状態になる条件は何か,走る,金装備を着ていない,チェストを開ける,攻撃する,1,マインクラフト,4
ピグリンの怒りレベルが「3(重度・死ぬまで許さない)」になる条件は何か,金ブロックを壊す,チェストを開ける,ピグリン自身を攻撃する,金塊を投げる,2,マインクラフト,4
ガストの悲鳴のような鳴き声は、何の動物の声を加工したものか,イルカ,猫,犬,フクロウ,1,マインクラフト,3
釣りにおいて「10個のイカスミ」が釣れる確率はどれくらいとされるか,100回に1回,500回に1回,1000回に1回,10000回に1回,2,マインクラフト,5
統合版において、爆発耐性がありマグマでも燃えないが、サボテンに触れると消滅するアイテムはどれか,ネザースター,古代の残骸,ドラゴンの卵,ビーコン,0,マインクラフト,5
村人を「防具鍛冶」に就職させるために必要な職業ブロックはどれか,金床,溶鉱炉,鍛冶台,大釜,1,マインクラフト,2
村人を「肉屋」に就職させるために必要な職業ブロックはどれか,燻製器,焚き火,かまど,樽,0,マインクラフト,2
村人を「石工」に就職させるために必要な職業ブロックはどれか,石臼(砥石),ストーンカッター(石切台),丸石の壁,製図台,1,マインクラフト,2
地図の縮尺を拡張する際、製図台を使うと「地図」と何が必要か,コンパス,経験値,紙(1枚),紙(8枚),2,マインクラフト,2
地図の縮尺を拡張する際、作業台を使うと「地図」と何が必要か,コンパス,紙(1枚),紙(4枚),紙(8枚),3,マインクラフト,2
地図の縮尺を最大まで拡張(レベル4)した際、表示範囲は何ブロック四方になるか,512x512,1024x1024,2048x2048,4096x4096,2,マインクラフト,3
地図を持った際、プレイヤーが向いている方角が「上」を指している場合、それはどの方角か,東,西,南,北,3,マインクラフト,2
「金のニンジン」の満腹度回復量はいくつか,4,6,8,10,1,マインクラフト,3
「金のリンゴ(通常)」を食べた時の満腹度回復量はいくつか,2,4,6,8,1,マインクラフト,3
Ver1.21で追加された「ヘビーコア」は何を作るための素材か,メイス,トライアルスポナー,銅のドア,風のチャージ,0,マインクラフト,2
「イリュージョナー(未実装モブ)」をボートに乗せると行う奇妙な行動は何か,ボートを漕ぐ,透明になる,後ろ向きに矢を放つ,分身する,2,マインクラフト,5
未使用データの「ゾンビホース」のテクスチャファイルに隠されている図は何の展開図か,鞍(サドル),防具,チェスト,ニンジン,0,マインクラフト,5
エンチャントテーブルに表示される「銀河標準語」を解読した際に出てくる、ある有名なRPGのタイトルは何か,ファイナルファンタジー,ウィザードリィ,ザ・エルダースクロールズ,ウルティマ,2,マインクラフト,5
リスポーンアンカーの環境音を逆再生すると何の音に聞こえるか,エンドポータルの音,ネザーポータルの音,ガストの鳴き声,レコード11,1,マインクラフト,5
ウーパールーパーの幻の色とされ、トレーラーには映っていたが現在は出現率0%となっている色はどれか,赤色,緑色,紫色,黒色,1,マインクラフト,5
ファントムを効率よく倒すために、着地地点に設置して捕獲するのにおすすめなアイテムは何か,トロッコ,ボート,クモの巣,ハチミツブロック,1,マインクラフト,4
「泡」がある場所に粉雪を使ってバグで作ることができる、本来ありえない状態は何か,凍った泡,水のない泡,燃える泡,黒い泡,1,マインクラフト,5
エンチャント「落下耐性」が持つ、落下ダメージ軽減以外の隠れた効果は何か,移動速度低下を防ぐ,エンダーパール使用時のダメージ軽減,ノックバックを無効化,スニーク速度上昇,1,マインクラフト,4
クロスボウで花火を撃つ際、ダメージを2～3倍に増やすために花火のクラフトで大量に入れると良いものは何か,火薬,ダイヤモンド,花火の星,紙,2,マインクラフト,4
柵(フェンス)の代わりとして使用できる、モブが飛び越えられない「ブロックと穴」の組み合わせで使うブロックは何か,スライムブロック,ハチミツブロック,マグマブロック,ソウルサンド,1,マインクラフト,4
地下を透視するバグ技で、フェンスの上から落として自分の頭に埋めるアイテムは何か,砂,砂利,金床,コンクリートパウダー,1,マインクラフト,5
村人が寝ている時の姿勢(腕の位置)はどうなっているか,常に胸の上で組んでいる,常に気をつけの姿勢,万歳などランダムで決まる,枕の下に入れている,2,マインクラフト,5
スニッファーの卵を「コケブロック」の上に置くと、孵化時間は約何分になるか,5分,10分,15分,20分,1,マインクラフト,3
統合版において、敵モブが持っている装備を新品の状態で確実に入手するために行う行動は何か,より良い装備を投げ渡す,水をかける,雷に打たせる,透明化のポーションをかける,0,マインクラフト,4
「アイテムのレアリティ色」において、エンチャントされた金リンゴやコマンドブロックは何色(ランク)に分類されるか,白(コモン),黄(アンコモン),水色(レア),紫(エピック),3,マインクラフト,4
森の洋館の隠し部屋にある「トラップチェスト」を開けると、TNTが起爆して何が出現するトラップがあるか,クリーパー,シルバーフィッシュ,ヴェックス,大量の砂,1,マインクラフト,5
「製図台」を作成するために必要な材料は「紙」と何か,原木,板材,棒,ハーフブロック,1,マインクラフト,2
「機織り機」を作成するために必要な材料は「板材」と何か,棒,羊毛,糸,鉄インゴット,2,マインクラフト,2
「樽」を作成するために必要な材料は「板材」と何か(統合版レシピ),棒,ハーフブロック,鉄塊,原木,1,マインクラフト,2
「調合台(醸造台)」を作成するために必要な材料は「ブレイズロッド」と何か,丸石,鉄インゴット,滑らかな石,レンガ,0,マインクラフト,2